{
  "family": "office-document",
  "app": "word",
  "catalogue_sha256": "sha256:2222222222222222222222222222222222222222222222222222222222222222",
  "ontology_sha256": "sha256:1111111111111111111111111111111111111111111111111111111111111111",
  "corpus_schema_sha256": "sha256:4444444444444444444444444444444444444444444444444444444444444444",
  "invariants_sha256": "sha256:3333333333333333333333333333333333333333333333333333333333333333",
  "plan_sha256": "sha256:5555555555555555555555555555555555555555555555555555555555555555",
  "driver_id": "sha256:6666666666666666666666666666666666666666666666666666666666666666",
  "by": "laptop"
}
